code,provider,providerURL,name,imageURLs,description,brand,category
5010993954353,HEO,https://www.heo.com/de/es/product/5010993954353,Star Wars The Mandalorian Black Series Figuras 2021 Mandalorian & Grogu (Maldo Kreis) 15 cm,"https://www.heomedia.com/img/nrm/d_hasf5317.jpg, https://www.heomedia.com/img/nrm/d_hasf5317_o.jpg, https://www.heomedia.com/img/nrm/d_hasf5317_p.jpg, https://www.heomedia.com/img/nrm/d_hasf5317_q.jpg, https://www.heomedia.com/img/nrm/d_hasf5317_r.jpg, https://www.heomedia.com/img/nrm/d_hasf5317_s.jpg, https://www.heomedia.com/img/nrm/d_hasf5317_t.jpg, https://www.heomedia.com/img/nrm/d_hasf5317.jpg, https://www.heomedia.com/img/nrm/d_hasf5317_a.jpg, https://www.heomedia.com/img/nrm/d_hasf5317_b.jpg, https://www.heomedia.com/img/nrm/d_hasf5317_c.jpg, https://www.heomedia.com/img/nrm/d_hasf5317_d.jpg, https://www.heomedia.com/img/nrm/d_hasf5317_e.jpg, https://www.heomedia.com/img/nrm/d_hasf5317_f.jpg, https://www.heomedia.com/img/nrm/d_hasf5317_g.jpg, https://www.heomedia.com/img/nrm/d_hasf5317_h.jpg, https://www.heomedia.com/img/nrm/d_hasf5317_i.jpg, https://www.heomedia.com/img/nrm/d_hasf5317_j.jpg, https://www.heomedia.com/img/nrm/d_hasf5317_k.jpg, https://www.heomedia.com/img/nrm/d_hasf5317_l.jpg, https://www.heomedia.com/img/nrm/d_hasf5317_m.jpg, https://www.heomedia.com/img/nrm/d_hasf5317_n.jpg, https://www.heomedia.com/img/nrm/d_hasf5317_o.jpg, https://www.heomedia.com/img/nrm/d_hasf5317_p.jpg, https://www.heomedia.com/img/nrm/d_hasf5317_q.jpg, https://www.heomedia.com/img/nrm/d_hasf5317_r.jpg, https://www.heomedia.com/img/nrm/d_hasf5317_s.jpg, https://www.heomedia.com/img/nrm/d_hasf5317_t.jpg, https://www.heomedia.com/img/nrm/d_hasf5317.jpg, https://www.heomedia.com/img/nrm/d_hasf5317_a.jpg, https://www.heomedia.com/img/nrm/d_hasf5317_b.jpg, https://www.heomedia.com/img/nrm/d_hasf5317_c.jpg, https://www.heomedia.com/img/nrm/d_hasf5317_d.jpg, https://www.heomedia.com/img/nrm/d_hasf5317_e.jpg",Un aguerrido cazarrecompensas sobreviviendo en una peligrosa galaxia y un misterioso alienígena perseguido por cazarrecompensas contratados por figuras imperiales.Estas figuras a escala de 15 cm fueron diseñadas para verse igual a los personajes de la serie Star Wars: The Mandalorian. Las figuras cuentan con diseño detallado y múltiples puntos de articulación.,Cookies,Cookies
MCF15527,HEO,https://www.heo.com/de/es/product/MCF15527,DC The Flash Movie Figura The Flash 18 cm,"https://www.heomedia.com/img/nrm/d_mcf15527.jpg, https://www.heomedia.com/img/nrm/d_mcf15527_d.jpg, https://www.heomedia.com/img/nrm/d_mcf15527_e.jpg, https://www.heomedia.com/img/nrm/d_mcf15527_f.jpg, https://www.heomedia.com/img/nrm/d_mcf15527_g.jpg, https://www.heomedia.com/img/nrm/d_mcf15527_h.jpg, https://www.heomedia.com/img/nrm/d_mcf15527_i.jpg, https://www.heomedia.com/img/nrm/d_mcf15527.jpg, https://www.heomedia.com/img/nrm/d_mcf15527_a.jpg, https://www.heomedia.com/img/nrm/d_mcf15527_b.jpg, https://www.heomedia.com/img/nrm/d_mcf15527_c.jpg, https://www.heomedia.com/img/nrm/d_mcf15527_d.jpg, https://www.heomedia.com/img/nrm/d_mcf15527_e.jpg, https://www.heomedia.com/img/nrm/d_mcf15527_f.jpg, https://www.heomedia.com/img/nrm/d_mcf15527_g.jpg, https://www.heomedia.com/img/nrm/d_mcf15527_h.jpg, https://www.heomedia.com/img/nrm/d_mcf15527_i.jpg, https://www.heomedia.com/img/nrm/d_mcf15527.jpg, https://www.heomedia.com/img/nrm/d_mcf15527_a.jpg, https://www.heomedia.com/img/nrm/d_mcf15527_b.jpg, https://www.heomedia.com/img/nrm/d_mcf15527_c.jpg, https://www.heomedia.com/img/nrm/d_mcf15527_d.jpg, https://www.heomedia.com/img/nrm/d_mcf15527_e.jpg","Figura articulada del universo DC, tamaño aprox. 18 cm. Viene en una caja con ventana.",Cookies,Cookies
5010993750191,SD,"https://www.sddistribuciones.com/SCOUT-TROOPER-FIGURA-15-CM-STAR-WARS-BLACK-SERIES-GAMING-GREATS-ISBN-5010993750191-Codigo-HSB,E99945L0",SCOUT TROOPER FIGURA 15 CM STAR WARS BLACK SERIES GAMING GREATS,"./Styles/Master/noimage.png, ./Styles/Master/noimage.png, ./Styles/Master/noimage.png, ./Styles/Master/noimage.png, ./Styles/Master/noimage.png","Hasbro presenta dentro de su colección Black Series Gaming Greats la figura del Scout Trooper, uno de los personajes del videojuego ""Star Wars Jedi Fallen Order"" basado en el universo Star Wars. Se trata de una figura articulada de unos 15 cm de alto. Incluye varias armas de complemento.",HASBRO,MERCHANDISING - PRECIO NETO
5010993874323,SD,"https://www.sddistribuciones.com/IMPERIAL-SHOCK-TROOPER-FIGURA-15-CM-STAR-WARS-BAD-BATCH-BLACK-SERIES-F29315L0-ISBN-5010993874323-Codigo-HSB,F29315L0",IMPERIAL SHOCK TROOPER FIGURA 15 CM STAR WARS BAD BATCH BLACK SERIES F29315L0,"https://www.sddistribuciones.com/Portadas/HSBF29315L0.JPG, https://www.sddistribuciones.com/Portadas/HSBF29315L0_1.JPG, https://www.sddistribuciones.com/Portadas/HSBF29315L0_2.JPG, https://www.sddistribuciones.com/Portadas/HSBF29315L0_3.JPG, https://www.sddistribuciones.com/Portadas/HSBF29315L0_4.JPG","Hasbro presenta dentro de su colección Back Black Series la figura del Imperial Shock Trooper basada en el aspecto de la nueva serie animada de la saga de Strar Wars ""The Bad Batch"". Se trata de una figura articulada de unos 15 cm de alto con gran calidad y detalle. Incluye armas como complemento.",HASBRO,MERCHANDISING - PRECIO NETO
5010993789924,SD,"https://www.sddistribuciones.com/DIN-DJARIN-THE-MANDALORIAN-AND-THE-CHILD-FIGURA-STAR-WARS-BLACK-SERIES-MANDO-MONDAYS-ISBN-5010993789924-Codigo-HSB,F08745L0",DIN DJARIN (THE MANDALORIAN) AND THE CHILD FIGURA STAR WARS BLACK SERIES MANDO MONDAYS,"https://www.sddistribuciones.com/Portadas/HSBF08745L0.JPG, https://www.sddistribuciones.com/Portadas/HSBF08745L0_1.JPG, https://www.sddistribuciones.com/Portadas/HSBF08745L0_2.JPG, https://www.sddistribuciones.com/Portadas/HSBF08745L0_3.JPG","Hasbro presenta dentro de su colección Black Series la figura de Din Djarin (The Mandalorian) y The Child tal y como aparecen en la nueva serie de Disney+ ""The Mandalorian"" basada en el universo Star Wars. Se trata de una figura articulada e incluye varios complementos.",HASBRO,MERCHANDISING - PRECIO NETO
5010993804740,SD,"https://www.sddistribuciones.com/BOBA-FETT-E6-FIGURA-15-CM-BLACK-SERIES-STAR-WARS-F12715L0-ISBN-5010993804740-Codigo-HSB,F12715L0",BOBA FETT E6 FIGURA 15 CM BLACK SERIES STAR WARS F12715L0,"https://www.sddistribuciones.com/Portadas/HSBF12715L0.JPG, https://www.sddistribuciones.com/Portadas/HSBF12715L0_1.JPG, https://www.sddistribuciones.com/Portadas/HSBF12715L0_2.JPG, https://www.sddistribuciones.com/Portadas/HSBF12715L0_3.JPG","Hasbro presenta dentro de su colección Black Series la figura de Boba Fett perteneciente al universo ""Star Wars"" tal y como aparece en el E6 de la saga. Se trata de una figura articulada de unos 15 cm de alto. Incluye efecto lanzallamas y 2x pistolas blaster como complemento.",HASBRO,MERCHANDISING - PRECIO NETO
